,reviews
669,"A must-visit once you touch down Singapore Changi Airport. Jewel Shopping Mall is connected to Terminal 1 and it is easily accessible by a link bridge from Terminal 2 & 3. 

The first thing to view is the Rain Vortex. It's a huge indoor water fountain that is about 5 stories tall. The water falls inwards. It has laser light show nightly. Surround the vortex is the Sheshido Forest Valley - an indoor mini forest with trees, plants, flowers and bushes. At night, the forest will be lighted up beautifully, with soothing surround music. You will see many people sitting round the forest, relaxing and listening to the fountain fall,  and enjoying the view of vortex. A great place for picture taking too.

After mid-June, you can try out the canopy walk and giant slide at the roof top. The kids will love it. However, remember to wear pants coz you don't want people at below level to see the colour of your undies! Oh ya, it is chargeable. Check out the price before entry.

There are many eateries in the mall, ranging from Chinese cuisines, Western delight, cafes, fast food, bakeries, snack bars, ice cream parlour to hawker food etc. You will be spoilt for choice.

Shopping wise, you can have top brands to local brands for fashion, nothing much special.

After touring Jewel, you can easily catch a MRT (subway or train) to your destination/hotel."
670,"Its located outside changi airport so you have to exit the airport to get there and it was nice and huge with lots of great food to try. 

Nice vortex waterfall and got lots of shops but love the selection of foods variety over there. 
You can find famous foods from all over the world from shake shack, kams, burger n lobster and etc etc. 

Just love the place at jewel. 
If you got long layover in singapore its a place to kill time."
671,"😋 😋 😋! 
Love it 🥰
So fishy fishball and soft . 
Dry noodle was mixed just nice 👍 with the right amount of sauce, very balance with the noodle."
672,"I spent close to 4 hours at the Changi International Airport at Singapore.
It was very less time to discover , what this wonderful Airport has to offer.
So idecided to skip the shopping malls and head straight for witnessing the JEWEL.

In simple terms it is the name give to the Architectural Marvel at the Terminal 1 of SIngapore airport.
It is also connected internally by a skybridge as well as a skytrain with terminal 3 of the airport.
The centrespot of attraction is the huge waterfall inside the airport.
I am not sure about the stats but i believe it is a 100 meter waterfall.
So you must see this from atleast floor number 4 and go down to the basement level B4 to see two absolutely different perspective of this waterfall.
Its simply awesome."
673,"Just went to Jewel, the view of the waterfall is excellent and the food there is delicious👍. There are many attractions there such as the canopy park, mirror maze and the bouncing net."
674,"If you are passing through Changi Airport, you must check-out ""Jewel"".  It just opened a couple months ago, and I can already see more green (vegetation) since the opening.  From inside the immigration area, if you take the skytrain between Terminals 2 and 3 - the train goes right through Jewel giving you a different view of the waterfall."
675,"After 5 hours exploring the Jewel, it felt like the Marina Bay Sands inside the Domes of Gardens by the Bay. I like the greenery and the large waterfall including being able to dine beside it. 

It generated lots of jobs to manage crowds and serve the food and shops. Service has been good. 

It’s crowded. If you don’t go to A&W and Shake Shack, you get to enjoy a lovely dining experience with the vast options available at affordable prices. 

It’s a feast for the eyes everywhere you go. A sensory overdrive and you will never get bored for hours. 

There is a lovely Fairprice Finess supermarket so well stocked. 

Don’t bother visiting the food court, it’s stuffy and dark. Not nice to eat there. The restaurants are much better with fountain view and cost a bit more but you will get a unique experience dining at the Jewel. 

I like that many of the shops offer free food sampling. 

My favorite restaurant is Maison de PB."
676,"Amazing place which operates like a large mall with ample of food selections (basement food court esp.) and big area to move around.

You just need to come to airport early for you departure flight so make this as your last destination before leaving.

When you thought the toilets in Singapore airport couldn't get better, this place just surpasses that expectation.

One of the main worries about crowded place is the toilet, or rather the lack of it, and it's cleanliness. But there is a toilet (with ample rooms) everywhere and it is so clean despite the crowd."
677,"Jewel Shopping Mall is located right opposite Changi Airport Terminal 1's Arrival Hall on the land side. Its claim to fame is the world's largest indoor waterfall, with multimedia shows centred on the cascading water held every night at hourly intervals ftom 7.30pm through 13.30am.

There are plenty of airside attractions within the airside areas of Changi Airport's four terminals catering to transit travellers. However, transit travellers using Changi Terminal 1 with a layover of at least 3.5 hours may wish to check out the huge waterfall right in the middle of Jewel Mall i.e. 2.5 hours for a pitstop and returning to the Airport airside about 45 minutes to an hour before the outbound flight ETD.  

Besides viewing the indoor waterfall, travellers may pick up some Made in Singapore products and food gifts, and perhaps grab a quick bite or some refreshments before the next flight. Changi Airport souvenirs and the world's first Pokemon Concept Store outside Japan are on Level 4 of Jewel Mall, while Level 1 hosts many of the Singapore food gift shops, i.e. bbq pork jerky (from 'Bee Cheng Hiang'), pre mixed spices and seasoning for popular local dishes like chicken rice, chilli crab etc. (from 'Taste Singapore'), local swiss rolls with coconut jam (from 'Rich & Good Cake Shop') and artisanal cookies with tropical herbs and other ingredients (from 'Cookie Museum'), etc.

Travellers leaving Singapore on red eye flights out of Terminal 1 may take a taxi to Jewel instead of the terminal building, for early check in on Level 1, followed by dinner at one of the mind boggling variety of F&B outlets spread across B1, B2 and Levels 1 through 5. Private hire vehicles may drop off passengers on Level 2; travellers should use the downward escalator near 'Shake Shack' fast food restaurant to reach the early bird check in counters on Level 1.

Travellers using the other Terminals 2,3,4 who wish to visit Jewel should may use sheltered, overhead link bridges. Personally I won't bother to detour to Jewel as there are enough shops and facilities in the airside areas to keep anyone occupied till ETD."
678,A great water fall show with all the planting hard to know you are in the middle of an airport. Surrounded by shops making it a very busy place with a lot of people if you want a quiet place to chill out this is not the place. plenty of eating options just could not find any gluten free options.
679,Never would I have believed an Airport would become a destination in and of itself.  The beauty and music are an amazing combination and time worth spent!
680,"I’m so stunned on how they manage to build a large forest indoor. It looks like they build everything for the trees to grow. Supply soil for it to root, water and food to fill its body, UV for it to photosynthesize, temperature control. The waterfall is so impressive.  The light"
681,"We originally planned to fly in from Kota Kinabalu and stay in a Singapore city hotel. Then we saw the info on the Jewel and the Yotelair hotel.  So, to the Jewel..... We arrived around 6pm, booked into the hotel and then went for a quick walkabout on the top floor around the"
682,"In spite of all the hype, Jewel Changi is just a massive shopping mall near a big international airport. Shops, shops and shops - and most of them the same brands and chains you can find anywhere in the world. What makes it different is the giant spectacular water feature and"
683,"We visited late afternoon/evening on a Sunday - so given it was a weekend and the Jewel has only been open for 3 weeks, the enormous crowds of people were perhaps not surprising! Nevertheless, the water vortex was fascinating, especially after dark with the added music and multi"
684,"In a chaotic mall, suddenly there’s an area with a superb vortex waterfall and a green surroundings. Good place for a break after few hours of shopping. It’s simply awesome."
685,"The waterfall trully impressive, but nothing else to see. The rest just a typical mall.  Ps. They have a pokemon store which not every country have it. If you're a pokemon maniac, it's a must "
686,A must see.  I'd happily spend all day there.  Nice bars and cafe on the top floor.  I'll go back with the DSLR and the family.
687,"Very good place to visit if you have time flying out of the airport or arrival with great chance to take photos , great for locals also to visit   Very well planned as expected in Singapore , good place to visit and spend extra hours before check in as hotel checkout is 1200 pm"
688,"The jewel is huge, full of shop, restaurants and sights to see. The only trouble is that half of Singapore comes to enjoy the “resort” that is situated in the middle of Changi airport- which means if you are a traveler so path is blocked by dawdling families, screaming kids,"
689,"Went to visit Jewel Changi for first time. New and latest attraction in SINGAPORE. Many tourist, travellers and local visitors. The main focus is the rain fountain in the centre of the building. Must see. "
690,The water feature is overwhelming- never saw anything like it. It's like something you would expect at Disney and Epcot (if they kept it up). The mall itself is too crowded with too many people taking selfies.
691,"Brilliant display of lights dancing within a 40m swirling vortex, in a centre of a 5-storey high garden with 2,500 trees and 100,000 shrubs, complete with monorail moving in the background and Hollywood blockbuster soundtrack. 

Be sure to catch this Rain Vortex show daily at 830pm, 930pm. Admission is FREE.

Jewel feels like a grand showcase of Singapore's ""City in a Garden""  vision."
692,"Was early at Terminal 2 waiting to pick up family members on an inbound flight and decided to see what all the hype of The Jewel was about.

Ok, essentially it is a mall with F&B outlets and entertainment opportunities like the Canopy Walk and Changi Experience.

The center piece was of course the indoor waterfall. Now, that was impressive. We were lucky to be there just when the light show started. Quite a sight.

By the way, the Jewel is located next to T1 and is connected to the other Terminals via a walkway.

Overall a decent enough place"
693,"with only one and half hour to spare prior to boarding, one can easily take a visit to this intriguing feature of changi. 5 mins to reach the waiting area after checking in our luggage. 3 minutes for the bus to arrive. 7 minutes to get to the drop off point and another 15 minutes to walk to the mall the center of which can be found the JEWEL of changi. from afar, it looks like a spaceship taking off. but upon approach, one can see why it is titled as such. the man-made waterfall was a big hit you cannot even take a selfie without a photobomber in the shot. you need to patiently position yourself to get the right angle to capture its magnificence.

i wonder how it looks like at night. i can only imagine the vivid colors those lights make when they collide with water. i wish we could stay longer."
694,"Feels like walking in the park, with a waterfall... actually you are inside a mall and connected to one of the busiest airport in the world, Singapore Changi airport.

Relax and unwind from your journey, either before or after or in between..."
695,"We had heard that the tallest indoor waterfall had opened at the Singapore Airport in April, but didn't think too much about it. We came through Singapore a second time on our five-week Asia vacation, and stayed at the Changi Crowne Plaza Hotel. The Jewel happens to be right next door to this hotel, so we walked over to this mega mall for dinner.

Wow--we had no idea! The waterfall was amazing and beautiful with the evening light show.  It's one of those travel experiences that could go either way (really good or really bad).  

It was fun to see locals visiting this new attraction for the first time. They were interspersed with airline travelers pulling their suitcases, who had extra time between connecting flights. It was Friday evening, so quite crowded (although we're used to that being from California).

The mall itself is great.  Very wide and spacious walkways and a large selection of restaurants.  We had a great pizza at the Pizza Express (and also terrific desserts).  

This experience was worth going out of our way for.  Apparently, the fifth floor will have various attractions, but it was closed when we were there."
696,This was the first attraction & impression of Singapore to us. We thought of spending 30 minutes however ended up spending 90 minutes there as the kids enjoyed viewing the waterfall and forest near waterfall. The aroma was pleasing and soothing. Worth a visit.
697,"I can safely say it is One of the best Garden Airport in the world. The indoor waterfall with its beautiful lasers depicting colourful lights display especially in the night is really awesome. There are also a large variety of food and beverage outlets for all young and old folks to choose for your tastebuds. There are 5 floors of everything branded shops etc and food, snacks like delicious burgers, fusion ice cream etc etc. The balancing Canopy Park at the top floor will be another eye openers for the young and middle age and the garden on top with beautiful flowers and plants on display are a sight to take in. 
A must visit on the way to airport to leave the country (allow extra 2 hours for your tour) Or upon your arrival. 
It will be best to make the Changi Jewel as an extra itinerary to take in the beautiful sights and shop and dine at the same time. Have fun & enjoy!!"
698,"The Changi Jewel is breathtaking. The centerpiece attraction commands the notice of the passengers and most eateries are located within view of the waterfall, making for very serene dining. The mall is also elegantly designed with very wide corridors and well-cleaned toilets. Must visit."
699,This place was something straight of an avatar movie. So much to look at. It really is a marvel and a must see.
700,"Now Changi Airport has a shopping mall with an awesome waterfall display.
Fantastic idea for those with a long stop over."
701,"If you are going to Singapore Changi Airport, you should visit the wonderful CROWN JEWEL OF Changi Airport. It’s was really wonderful experience."
702,"The vortex and greenery does remind one of Gardens by the Bay and it is truly hypnotic looking at the water cascading down at the various vantage points. This will be the next viral photo after MBS surboard rooftop. The variety of stores and duplex concepts do make your heart skip a beat but unlike MBS, the price range is a lot more accessible. I like the fact that local brands are showcased in this mall like Naise, Supermama, Rich and Good, Lim Chee Guan. There are so many eateries that you will be spoilt for choice. I also like the ample toilets/lifts/escalators that are easily accessible and not tucked in 1 corner to maximise retail leasing real estate."
703,"Changi Airport is the best airport in the world, and so Jewel Changi is the best shopping mall in Singapore.  The indoor waterfall is definitely a spectacle, together with the vegetation inside the mall - simply an oasis.  The building was very thoughtfully designed that allows sunlight to light up the mall and reduces its electricity consumption.  There are also many famous shops and restaurants here - lots to try and lots to do!"
704,"Jewel Changi Airport is a real jewel. A real gem in that sense. I was there for the pre-opening and was taken aback by its beauty and lush greenery. The indoor waterfall, Vortex is the main highlight of the Jewel. Beautiful! Aside from that, there are many shops and eateries. Must visit!"
705,"It’s a great place for all ages. I like the fact that most of it are our local shops. There’s movie theatre, loads of different entertainment for all ages. I went there during the preview and it was not as crowded as I thought it will be. Spacious. Though I miss my A&W, the queue doesnt worth my effort. Probably will head back the mall after 6-12 months when it’s less crowded. My two cents: perhaps there will be more free seating area added? It is a fantastic place for seniors to go to and hence it will be good there’s more seats for them to rest their legs after walking."
706,"The whole area is so spacious, combining leisure, nature, shopping, dining, entertainment activities all under 1 roof. The cannot miss - HSBC Rain Vortex. Jewel Changi Airport, it's not only a place for the tourists, but also for locals. Travelling in between terminals is a breeze..I love the place."
707,"This is one of the most amazing shopping centres I have ever seen. It is absolutely spectacular - you could spend hours walking around & still not see everything.
There seems to be an endless number of restaurants & shops, with a constant stream of people walking around enjoying the atmosphere.
The centre attraction is the rain vortex - simply stunning - the designer / architect  who came up with the concept to the engineers who brought it to life have to be extremely proud of this achievement.

Definitely worth a visit, and plan to spend at least a couple of hours there."
708,"This place was picturesque. Definitely take in the waterfall as it will leave you wanting to look at it for hours. I could have easily stayed there with a book for the day. It doesn't feel like an airport when you are there, it feels more like a mall. They've set it up in so residents of Singapore can visit anytime - flight or no flight. It is a great attraction and would recommend it to a friend."
709,"Either just to catch a flight, meeting a friend before taking off or just a transit stop, Jewel just added a great reason to be there early! So that you’ll have more time for dinner, shopping and leisurely enjoying the ambiance! It’s setting new standard for an airport environment! Convergence of tropical garden /Vortex with dinning/shopping while waiting for flight Or time to pass!"
710,"Just recently inaugurated the latest attraction of Singapore Airport - JEWEL of Changi. The sunday morning, thousand of visitor crowded at Jewel, the international travellers as well as the locals, visited the spectacular attraction of highest water fall at Singapore. So many visitors queeing up orderly thru the 5 levels of staircase and travelators. And, so many eateries and restaurants catering the visitors. Its a holiday sunday, young families as well as the
olders spectators coming to the vanue. No wonder that Singapore is famous for sophisticated high tech attraction. Beside 4 international terminals, now Jewel is included as the new destination for the travellers as well as the general public in Singapore."
711,"A huge shopping centre with numerous restaurants. Crowded with locals and tourists. Snaking queue for Shake Shack. The main attraction, HSBC Vortex is lovely, good for photos but was crowded most of the time. Good for passengers to pass some time while waiting for their flights."
712,"Let's start with the good:

1. Amazing mall and amenities.
2. Easy access to the airport
3. Good restaurants
4. Early check-in for select airlines (CHECK BEFORE GOING)

And the bad (why it is only getting 3 stars):
1. Scraping the barrel with brands. When Shake Shack has the pole position in a brand new $1.7b mall and is rubbing shoulders on that same level with Tokyu Hands and Muji, makes me worry...
2. Drop off has NO ACCESS TO EARLY CHECK IN!!! Beware. If you are thinking that this is a HK IFC style set-up, you will be sadly mistaken. The Jewel drop off is located a level above the early check-in, there are NO CARTS provided and the carts (even if there were any) are not allowed in the mall to go down to the early check-in. Horrible design and just a shame since they were so close to getting it right... How are you supposed to use the early check in if you can't even get to it???
3. Hotel: The Yotel is a joke. DO NOT WASTE YOUR TIME! It is very hard to get to (up on L4), the rooms are no larger than a closet and if you have bags with you, as point 2 states, you can't get a baggage cart to take them to the hotel with you...

Other than that, thought it was an amazing place!"
713,"One can’t help admire the shopping mall of the future! 

Great place to see, shop if you have deep pockets, & relax in their garden with luscious greenery & the HSBC Rain Vortex right in the center of the Jewel.

Plan to visit Jewel on your free day, I don’t think you can get all things (eat, drink, shop, & look around) done in 4 hours. The Jewel is quite a distance from Terminals 1, 2, 3, or 4; you must have a layover or not less than 10 hours to enjoy Jewel."
714,It has just opened. You have to add to your list of places to visit while in Singapore. Please leave plenty of time to spend there or you just might miss your flight.....
715,"This mall is situated at Singapore Changi Airport area. It is easily accessible via public transport, and is connected via walkway to 3 of the airport terminals. You could also at the skytrain from terminal 2 or 3 to go there. There is a garden with an indoor waterfall in the"
716,Gorgeous Manmade wonder on earth. A veritable rainforest which comes alive in the evening with the beautiful colors.
717,"If you arrive early to the airport, check in at the counter and then walk to the Jewel Mall before you go through security. This new futuristic looking shopping center has in its centerpiece the world’s largest indoor funneled waterfalls surrounded in a park like setting. The"
718,"So beautiful! At night there are displays at the world's largest indoor waterfall. There is a supermarket, cinema, variety dining choices, including shopping! Easily connected to terminals 1-3 and mrt station (t1), you definitely need to come here when you are in Singapore!"
719,"There were a lot of buzz about the latest Jewel in town (well, Singapore is a tiny country after all).  I got myself 15 mins spare before departing to walk around this fountain and see why .. it’s a beautiful architecture and well worth the walk.. all the greens and sound of the"
720,"Passed by today, just there for a transit. The jewel mall attached with airport terminal can easily access via sky bridge. 

There are waterfall show once in every hour."
721,"Met up a friend at the Jewel Changi Airport, and I was totally impressed with the futuristic architectural design as well as the spaciousness, and great varieties of shops and dining choices. 

We have the World’s Tallest Indoor Waterfall with a nightly light and sound show being projected on the sheet of the plunging water. 

A canopy park will be slated for opening in June. There are a number of roof TOP restaurants.

Don’t forget to try the durian pudding from the 717 Trading shop, which specialises in offering durian made pastries. 

This is definitely a great space for you to spend time if you have a long connection time for some retail therapy, or have a great meal with a wide array of options - American burgers, Spanish tapas, sandwiches, Chinese dumplings or almost anything you could think of.

Big retail stores of Nike, Fila, Adidas, as well as the high end boutiques are found in this five storey building. 

It is great to meet a Friend for a cup of tea/coffee if you live in the East Coast of Singapore. 

Nearest MRT - Changi Airport. You could walk to Jewel from Terminal 1,2 or 3 through the link bridge."
722,"Wow!! What a place, excellent location for the Jewel shopping mall to be located, just a stone throw away from changi terminal 1.
The place is really, really exciting, interesting, environmental friendly, the center of the building has a huge waterfall, fully AC, lots of shopping areas, huge sighting seeing setting.
Highly recommended if one is around changi or in Singapore"
723,"Wow, this place is totally surreal. A giant circular multi-level shopping mall with a garden and a stunning waterfall in the middle. It was very crowded when we were in, but I guess it's as expected considering it was a weekend and this place has had just opened."
724,"The Jewel is not just another shopping mall, it is the most outstanding and beautiful experience for a property that is essentially a retail offering. You will find it hard not to imagine yourself in a forest in many of the locations around the building. No attempt to maximise the retail area, this mall gives substance to design and space.The waterfall which descends from the glass domed roof is spectacular. It  opened in late April and has quickly become the go to shopping and eating experience. Many airline passengers arrive early with early checkin counters for most or all the airlines at The Jewel. It is a great place to visit before your flight. There are so many restaurants to choose from and the design of most is so creative. Excellent addition to the Singapore shopping experience."
725,This is what going to an airport should be. Vortex waterfall is amazing. The mrt transport to the airport is first class. Singapore is a wonderful place to visit. 
