,reviews
401,"We had a look around when we arrived. There are lots of activities to do for all ages, lots of shops and restaurants around which open late. The waterfall and garden is nice to visit and have a look at especially on the top floor to get a good view of the whole area. Lots of"
402,"I would recommend you guys to visit jewel! Why? There’s 24 hours foods and drink which is great for travellers who’s travelling to singapore ! And also jewel provide a lot of stores , and when night time there’s even light show , for more information about jewel shops directory"
403,"It’s beautiful no doubt. Lots of shops and eateries. Went to the Canopy Park. Nice stroll, inexpensive. The waterfall light show is a must do. "
404,We came early before our dawn flight and took the time to just browse around & check out the talk of the town center when all stalls were still closed.   Found the huge center piece of a water funnel feature surrounded by with nice foliage with restaurants on one floor and
405,"certainly deserve Changi airport and Jewel become the best airport in the world
their facility is alot more that we can use it.
Modern clean and clear information about everything.
the best thing about changi, it connect to rest of the world : asia, europe, Ausie, and even America."
406,Great experience and magnificent engineering. Yes there are lots of tourists / travelers but what would you expect in an airport. The shops are everywhere but you dont have to visit them. Worth seeing it
407,I have come through here at least a half dozen times and failed to stop and look. I’m glad that I took the time today. It’s a good place to people watch!
408,"If you are visiting Singapore,  before you leave changi airport you can go to Changi Jewel. Main attraction here is the rain vortex, 40meter high world tallest indoor water fall. There is a light and sound show at night and the water fall act as 360 degree screen."
409,"Love Changi Jewel, my daughter asked if it is the best airport in the world and I said probably; at least it’s the best I’ve visited.  Choice is excellent - restaurants right through to food court options, designer labels through to Muji.  

Lots of non shopping activities too”; rain vortex, canopy walk, net walk ( not great if you fear heights ) , cinemas plenty of ways to transit well.   

Only issue is it really 24 hours ? We landed at 3:30am and we’d told to stay in T2 because nothing but restaurants were open.  We of course went anyway; child was hungry.   At 4am the 5am and even 6am the only things open were the doors.  Five restaurants are 24 hr though they say ... well the one we found only served white / black coffee and only plain bakery items after 6am; child wanted the advertised the ham and cheese croissant but could only have a  plain one until after 6 am. I couldn’t get noodles or soup until 7am.  None of this is awful and when the food court options opened they were excellent for airport food but the Jewel isn’t 24 hrs."
410,It is a giant glass dome filled with plants and a giant cylindrical waterfall going from ceiling to floor. Also there are many areas to go to like the canopy park which you have to pay for but it is worth the money as you have many attractions and views within it. A good place to go for endless fun.
411,"Latest attraction at Changi Airport.  Too many tourists.
Wonderful sight.  With shopping area attached and restaurants to dine.  
Watching the flow of water makes you forget your  worries."
412,The Changi Airport is amazing! We visited Orchid park and we liked very much. It's a very touristy and shopping airport with a lot of shops and restaurants.
413,"Rain Vortex Jewel-Singapore Changi Airport:
- Wonderful
- Worth to see
- Free
- Majestic
- Next to Terminal 1"
414,Very touristy and shopping. Leave more time for transitting as it takes sometimes from Mall to different terminals
415,"It’s built in the middle of the shopping mall, very tall artificial waterfall, around 5-6 floors high surrounded by a forest like environment, very impressive! The shopping mall is located in between terminal 3 and terminal 2, easy to access. Don’t miss the chance to shop and"
416,"Jewel is an amazing place but don't go on the tour as it's a waste of money. You get to see the same great sights just differently via the bridge and the other ""attractions"".  Don't go on the Manulife skynets especially if you use their provided socks as it's just painful not"
417,"No other airport has this! The spectacular  mall connected to changi airport. Wonderful architecture, reflecting the “garden city “theme . High ceiling of course- the waterfall in the middle is the key attraction. Numerous restaurants and plenty of options for tourists buying"
418,Everything is there. However my overall experience was negative due to the large amount of people there (it was a long weekend). Everywhere I went had a long queue 
419,Visited during a stopover - its outside (not in departure area) - interconnected within Terminal 1 and 2. Its connected to a shopping mall - restaurants and shopping that's connected to the airport. Its stunning piece of engineering - great photo opportunities and stunning
420,"Just had a movie marathon on a Sunday at Shaw Theatres Jewel watching 3 movies in a row starting from 1030am. As it was a Sunday morning, bought 3 pairs of tickets for the price of 3 tickets using M1 telco 1 for 1 movie. Alternatively can use SAFRA 1 for 1 movie. Had breakfast, lunch and dinner here. There were plenty of choices for food options. Over hundred of restaurants and eateries. While there were sufficient gaps in between movies, you can opt to window shop at the various boutiques and outlets, take photos at the World biggest indoor waterfall, or sign up for some of the more adventurous activities at the highest floor. For example hedge maze, mirror maze, bouncing nets, walking nets or walk across glass bottom canopy bridge. And there are few bars at the highest floor which is a good place for beer or wine. I am sure you will find activities to occupy the day here."
421,Superlative is the word to describe this gem of Singapore. Makes most Singaporean proud lets go again
422,A must see when in Changi International airport. My breathe taking!! Very beautiful. There is a link bridge from T2 to Jewel
423,"We had a 9 hour layover in Singapore and I booked tickets for the canopy park before we arrived. 
The kids loved the indoor garden, foggy bowls, slides, walk nets, mirror maze- it was just amazing and then the sun went down and the place lit up! The light show in the waterfall was beautiful. 
The time flew by, I didn’t get to look around the shops.
There were plenty of lovely looking restaurants but I was outvoted & after 2 weeks of Vietnamese noodles, the kids wanted Burger King."
424,"We spent the day there, while waiting for our flight. The Jewel is beautiful with many different shops and food outlets. If you have the opportunity to see the light show at the water feature, don’t miss it!"
425,"A recently opened shopping complex located adjacent to the best airport in the world, Changi Airport. Free and nice waterfall show, plenty of dining option. So far couldn’t find any flaw."
426,We visited the jewel before a long haul flight. We checked in our luggage early so we could walk over a little easier. We were glad we did as although there were facilities for luggage it was super busy and would have taken too long to organise. The waterfall is incredible. You do feel like you are visiting a botanical garden with an impressive centerpiece. The rest of it is much the same as any other mall in Singapore with an good range of shops and restaurants.
427,"recently opened to the public this tranquill attraction offers a cool retreat from the heat. You might consider this a ""day trip"" if you are staying anywhere in Singapore. An easy metro trip to Jewel will reveal a delightful visual treat. With various levels of ""touring the Jewel"" you can see one or all the different levels of Jewel. Be sure to see the ""robo cleaner"". A quick snack or more and world class shopping and gifts are available if you have the time"
428,"Spend a few hours to see the World’s tallest indoor waterfall(HSBC) Rain Vortex, 4-Storey Shiseido Forest Valley,new to market shopping brands ,countless restaurants,and casual dining in the fabulous food court."
429,"What a great place to spend a day. Shopping, food, and really out of the world indoor water falls. Singapore never ceases to amaze you in what they can do, how indoor and outdoor boundaries are intermingled there. Amazingly done!"
430,"Whether this new comer can stand the test from the already excellent Garden by the Bay, Botanical Garden etc is in question, its entertainment level for visitors is high. The tremendous scale of the water feature must be another first for the world. The best time to appreciate its roar is when lighting is on in the evening. A must for tourist if you have time before boarding your return flight."
431,"For travellers with limited lay over time in Singapore, the Jewel is a great option to get a good flavour of Singapore without having to go down town. Lots of food offerings across budgets, have a shower, catch a movie, shop and shop."
432,True jewel. Take time to definitely see the jewel Mall at terminal 1 Changi airport Singapore. Apart from shopping and food the huge waterfall inside the Mall is one of its kind. You can spend the whole day there.
433,The crowd has subsided at 4pm saturday ..not so crowded ... But dinner ctowd returned from 6pm onwards.... Jewel is a dinning area for most locals... I noticed the early checkin counter has quence n hope this area can be bigger n tourists can drop their luggages faster to hv more time to explore the place
434,It is a vast and happening Mall. The water fall is a great attraction with changing colour lights. Most of the renowned brands have outlets. 5th Floor has many paid activities and pubs.
435,"Wasn't too keen on visiting a mall by the airport (!) but frankly this is a pretty spectacular set-up - a no-brainer for visitors with just a few hours to spare and quite the fun destination for a different family outing with Pokemon fans in tow... Access is also very easy with a well designed car park, something which isn't that common here... Overall, quite a fun shopping destination with a little bit for everyone...

I'm not sure I ascribe to the hype around Shake Shack - location is terrible with a very small restaurant with clearly not enough tables for the demand, leading to people hovering around the few tables available and the food not tasting as good as in other international locations."
436,"We stayed overnight at Singapore airport so we could experience all the amazing gardens and things we saw advertised but at the end of the day Jewel was just another big shopping centre with a big indoor waterfall (Rain Vortex). Lots of high end shops and places to eat but not really a lot to do there we didn’t think. We checked out the waterfall and garden, had lunch at Express Pizza, walked around the shops, went to the movies, checked out the L5 attractions (you need to pay for these), had dinner at Jack’s Place, checked out the Vortex light & sound show (which was spectacular), checked out some more shops, took the skytrain to Terminal 4, checked out the Petal Clouds (moving art work), took the Skytrain to Terminal 2, checked out the Kinetic Rain (more moving artwork) and that was the day over. The next day we had breakfast at the Pazzion Cafe Level B1 (that was a great breakfast), took in another movie at the cinema, walked around the shops again then headed to Terminal 1 to catch our flight. Other options to fill in time were to go on one of the Singapore tours (we had already spent 6 days seeing the city but if you’re just passing through then one or both are probably worth doing). The Social Tree and the Cactus garden were the only real highlights at T1."
437,"Singapore does it again. I really think Changi airport is a far away runner of best airport in the world. The jewel is an amazing architecture which you could just really sit there all day long and marvel at it. Aside from the falls, i really like a jungle atmosphere around it where you can sit there for hours and just relax"
438,"When we reached at Changi airport from Bangalore, we thout it better to see Jewel before passing towards departure gate as we could miss it afterwards. Although we missed the lift so my son had to stay with our baggage otherwise he could also have accompanied us. Many people were going to see it. It could be reached through travellator very fast as whole pathway
 could be covered by it too much walking isn't required. One must see it while arriving or departing Changi airport, its on terminal1. A 40m high water rain fountain
 could be thrilling with changing lights."
439,"The evolution of technology makes the impossible possible; indoor parks, eateries, shopping ""all in one"" - Jewel"
440,"It is a uniquely-shaped mall with an indoor waterfall and greeneries. The main attraction would be the Rain Vortex, which is the world's tallest waterfall, and it is located right in the middle of Jewel. If you are visiting at night, do remember to catch the free Light & Sound show! Seating areas are available among the greeneries surrounding the Rain Vortex where you can comfortably watch the show. 

As a mall, there is a large variety of shops to shop around. Also, food options are aplenty, so don't worry about not finding something to your liking."
441,It’s takes about 10 min walk from terminal 3 although you can access from any terminal.  It’s really beautiful from the top and looking down or from the bottom.  There are seats at the bottom and small seats where you can enjoy some quiet time enjoying the waterfalls and the green space.  It’s free unless you take a tour.
442,"Even though Jewel is next to/part of Changi Airport - it is a stand alone 5 Star attraction! We visited Jewel and was amazed by the following:
1. Although the indoor waterfall is its major attraction; and it is incredibly beautiful and majestic and perfectly designed, it is NOT THE ONLY attraction.There are activities for both adults and kids.
3. Viewing the waterfall - be sure to walk around it because the 365 degree view is well worth it! For those without the necessary time, I would suggest you quickly go down to the bottom floor and take in the 365 view; and then go up to the top floor and do the same thing! Well worth it.
2. For the kids there are two attractions(which adults would also enjoy) (a) for older kids, visit the Sky Nets - this is a corridor of nets, yes nets, hung up HIGH in the ""sky"" where one can walk along with the kids; very enjoyable; and (b) for the young ones, visit the canopy park where there are many simple but enjoyable things to do such as ""misty grass ponds"", animal kingdom walk...
4. For adults, there are many shops(including most brand names), restaurants etc that will keep you occupied for many hours......
Jewel is well worth a visit. It is joined ""at the hips"" with Changi Airport. Hence one could check out early, check in the luggage and visit Jewel: allow for at minimum 90 minutes."
443,"I am in totally in awe! Just amazing! No problem if you checked in early because you will never get bored just by staring at the calming waterfalls. Even the staff/concierge are friendly! Superb architectural design, amazing!"
444,"With the limited time that I had and no prior booking of any tickets,  decided to buy ticket to enter Canopy Bridge.  Got the last slot: 21.00-22.00.

So, it was a path where you passed through.  It has a see through floor, so we could see what was going on - beneath us, in the lower floors.  We could also take a beautiful selfie picture with the giant waterfall.   Take many of them as it changed colors ie blue, green etc.    

Recommended to see place.    Ticket cost only  SGD 8/pax (adult) 
 
>> TK-Aug2019"
445,"Jewel is easy to access by crossing the street or by going down the escalator via the subterrean access of terminal 1 of the Changi Airport who was, is and will remain the best airport in the world. Inside the Jewel, there are numerous top~notch shops with a breathtaking 115"
446,"Ok, so the waterfall is impressive.  There are tons of restaurants, shopping mall type restaurants, lots of the same shops you see in every mall. The reason I scored it so low is that the signage is a nightmare. I just wanted to get to Terminal 3 and Crowne Plaza, but we walked"
447,"The latest It Place in town! Interconnected to Terminal 1+2 of Changi Airport, Jewel is a vast shopping complex with new as well as popular brands of f&b and lifestyle to cater for everyone's insatiable needs in this modern world, such as: ShakeShack, BurgerAndLobster, TimHoWan,"
448,"My family had a wonderful time passing by T1 while coming in & out of SG. It has a life of its own, we all loved how they blend the greens (the park and vortex waterfall) with a mall and an airport all in one. The tiredness was swept away by the amazing experience. Thank you SG!"
449,"Schedule your stop over at Changi Airport and make sure you have time to visit the Jewel. Amazing things in there, indoor gardens, the largest indoor waterfall, just spectacular. "
450,"If you really want to explore the area, you would need a day but typically a couple of hours should suffice. They have theme parks, adventure rides and a lot of other activities in addition to the rain vortex. Highly recommend taking a tour round it when you have 2-3 hours to spare at the airport."
451,Changi airport have gone all out to entertain Travellers and fill in those transit hours!  Make sure you allow enough time to visit terminal 1 to watch the spectacular water and light show. There are also many many food outlets and of course all the big name shops. You could spend a day just seeing everything. The butterfly enclosure in T3 also worth visiting. Although open 24 hours the butterflies are pretty quiet at night.
452,This is the worlds best stopover airports as it has incredible facilities in the modern infrastructure and this shows a true image of the independent country Singapore
453,"Changi Internatioal Airport is I think the best international airport that I've been to. It has the finest artwork and building design. 

The Jewel is a long walk from Terminal 2. If you are in Terminal 4 you have to ride a shuttle bus to go to Terminal 2. When in Terminal 2, there are signs to help you go to the Jewel.

The Jewel is the world's tallest indoor waterfall and the centerpiece of the jewel. It is surrounded by trees, flowers and various plants. Outside the jewel is a big shopping mall with nice restaurants.

When in Changi International Airport,you should not miss this free attraction."
454,"Jewel at Changi Airport is a modern, futuristic with a touch of nature is the main attraction of this new mall located and connecting the 3 terminals at Changi Airport. At its core lies the towering Rain Vortex, an indoor waterfall that stands and drops 130 feet high surrounded by lush indoor tropical garden and a canopy trail on top. The mall is 10 stories high 5 above and 5 below. It features more than 200 shops and restaurants, hotel, cinemas, check-in area and lounge. Amazingly, is it very convenient to get here, 20 KM from the city center it has many entrance and exits all connecting to Changi's main 3 terminals. It also has  the monorail connecting terminal 2 to 3 that passes thru the waterfalls. It is a picturesque relaxing mall with many shops, restaurants, and amenities not found in other malls in SG. If you wanted to go near the waterfalls there is a bridge that allows you to pass by for around 7 SGD and the Canopy park surrounding it for 5 SGD. There are many spots to take a nice insta-worthy shot of the waterfalls on all levels for a great memory of your visit. It even has a light show at night starting from 0830 PM to midnight every hour. Some unique and first shops in SG to open here in Jewel include Apple store, Footlocker, Shake Shack, Cafe Amazon, A&W, Maison de PB to name a few. The Shaw cinema is also located at the basement 2 near the food court. So there, if you visit Singapore, transit in Changi or lives here it is highly recommended to have a visit at the Jewel of Singapore."
455,"Often crowded, this mall is still great for families. The waterfall is the attraction. Lots of retail and food and beverage options. The tickets to the maze and recreational areas at the top levels are slightly pricey but they are a hit with kids."
456,You have to hand it to the Singaporeans.  What do you do to maximise revenue from real estate at the airport?  Build a retail and amusement centre rolled into one.  The forest and waterfall are spectacular and a great way to wind down between flights.  Lots of restaurants and bars as well as shopping.  Well worth the walk to get there from Terminal 2
457,"If you have the chance to visit the Jewel on your way to the Singapore airport be sure you don’t miss it. From here it’s only takes about 10 min to get to departure gate 3, so if you have some time to kill...... the fountain and the forest at the hart of the mall are overwelving...... so even if you don’t want to shop. Have your taxi drop you off at the Jewel before you have to check-in"
458,"Family outing. Eye opener for my 80 years Mother. Lot of choices for food. Beautiful build up. Spacious, well decorated. Waterfall is the main attraction! Gorgeous"
459,"This is a brilliantly designed shopping complex.  Even to the design of the walkways which are well and truly wide enough to accommodate people wheeling full-sized suitcases, and there were many of them when we were there (the complex is next to the airport and fully accessible for departures.  There are also baggage storage rooms available.)  There are absolutely endless food choices throughout the centre, and the waterfall vortex and surrounds are magnificent.  At the risk of sounding cheesy, this really is a jewel!"
460,"This is probably the most iconic airport shopping mall in the world. It makes tourists choose Changi as a stopover destination or causes them to prolong their stay in Singapore. It is also an entertainment destination for locals. A heartlander friend of ours takes all her overseas visitors to Jewel and Gardens by the Bay. In addition to all kinds of shops and restaurants, you also find a supermarket, a cinema, and amusement park-type distractions. Last but not least, it is very much in Singapore’s image - an thoughtfully-planned and expertly-executed garden city. Genius Moshe Safdie!"
461,This place is fantastic.  Not to be missed if you are passing through Singapore. Highly recommended. You will be impressed.
462,"This place is a massive tourist attraction in itself. If flying to or from Changi you must allow at least an hour to visit Jewel; it’s out of this world really! Or it’s even worth a visit if not flying...
It’s enormous and beautiful. And to think it’s just a free attraction in an airport. Incredible!"
463,"Being from the United States and traveling abroad often, I can appreciate how severely lacking my home country's airports are. However, a visit to the Jewel made me realize how far behind EVERY other airport on the planet is compared to Singapore Changi. 

Yes the Jewel is really just a shopping mall attached to the airport. However that mall has outlets of a large numbers of top restaurants (both ""high"" and ""low"" end), a huge number of retail stores, some great attractions, and at its core...OMG one of the most refreshing and delightful indoor spaces I've ever seen! 

When you fly out of SIN, arrive at least 5 hours early, take advantage of the early check in located in the Jewel, and walk around a bit. If you don't want to spend any cash, just sit in the waterfall atrium and soak in the gorgeous space. 

Oh and be on the lookout for the friendly robot floor cleaners!"
464,"Unbelievable. You should try and at least see the rain vortex. Catch the shuttle bus or walk over from the adjacent terminals before you go through immigration, or on your way out. Allow at least an hour. The whole complex is a shopping paradise with the water feature the highlight. Here is the suggested plan to get the most of the facility. Book your outward flight for the late afternoon, evening or night time. Allow 2-3 hours to wander around the complex, do last minute shopping and have a meal. If your shopping will be limited to carry-on items, then you can maximise your time by taking advantage of the early bag drop (up to 24hrs). Then just allow an hour for immigration and boarding time. Even if you only do it once, experience this complex and you will always wish all airports could be like this. Highly recommended."
465,Lovely place to waste away the time the waterfall light show is amazing and well worth watching if you cam
466,"Tourists or Singaporeans alike, there's something to do for everyone. Some tips we discovered that not many major travel articles have highlighted are:  1) They have early check-in of luggages up to 24 hours before flight, only for certain flight brands though. We realized"
467,Wow first time look at the new jewel attached to Singapore Airport. Fair to say spend an hour touring this place you won’t be disappointed. We have just done 8 hours here with a massage and some lounge time a wander and a bite to eat.
468,"One of the wonderful attraction in the world made artificially. Changi is one of the best airport we know, the latest attraction is the jewel and it is a man made waterfalls with lot of real trees inside the airport which makes it a mini jungle. You will indulge in this, if kids"
