,reviews
0,Fascinating impressive check in station for all the youth and the indoor man made garden is kind of memories for Singapore. Keep it up Singaporeans 💪
1,"I’m Singaporean and I don’t think I’ve ever been prouder of any mall in Singapore, until Jewel came about. It’s one mall I will make a trip to over and over again, because it has all that I need. 
1. Kids friendly cinema. Not many of my friends know this but Shaw has this cinema here that specially catered to parents with kids. They have a play area in front of the seats and the cinema is also dimly lit but bright enough for parents to watch over their little ones when they play at the play area. People are generally more understanding of noisy kids.
2. My favourite shopping outlets are all in this place - Zara, oysho, mango, cath kidston, seed by heritage for kids.
3. The food options are great and I always frequent one of these - violet Oon, beauty in the pot, burgers and lobsters, and snack time at birds of paradise, old Chang kee, Toast Box and leClaire by sarah Michelle.
4. Without a doubt, the BEST nursing room ever has got to be in Jewel. I was blown away by how comfortable the nursing rooms are."
2,"Singapore is hot and humid. The most of time we spent there was indoor. And Jewel was the best place we found, with beautiful waterfall and lots of shops and restaurants."
3,"Passed by many times and the rain of the sight of the rain vortex had never failed to arrest me. A few moment to admire the scene (definitely) then quick snaps of photos (if short of time) or a rest in the ""forest"" to watch the water flowing down. The place was always crowded with local and tourist alike but I could feel myself relax down. Kid really enjoyed it. An oasis right amidst the hustle bustle. If you transit or arrive in Singapore, recommend to come and admire this architect marvel."
4,"A brilliant design and architecture.
a jewel in an airport indeed.
a great place to spend time in waiting your flight."
5,"We flew from Changi to Sydney and were eager to visit the recently opened Jewel.

We checked in for our flight then followed the signs, which are clearly displayed, to this amazing feature.

It was very crowded, and we didn’t want to miss our flight so we weren’t able to spend as long as we would have liked, but it certainly takes your breath away. The lifts were very slow and jam packed so that made it harder to see everything. I gave up and walked down instead.

This wonderful attraction is linked to three of its passenger terminals, and was quite a walk for us from check in.

Built in a huge glass dome, the centrepiece is the astonishing Rain Vortex, the tallest indoor waterfall in the world. It’s surrounded by lush vegetation and terraces where you can sit and gaze at it in all its glory.

The site covers over 8 acres and has 12 storeys, 7 of which are at basement level.

The glass and steel facade was actually designed by the same architects who designed the Marina Bay Sands Hotel, with its iconic ship perched on the top of the building.

The Shiseido Forest Valley is one of Asia’s largest indoor gardens. It covers around 22,000 square metres and spans 5 stories. It’s extraordinary to think that there are around 3,000 trees and 60,000 shrubs from all around the world.

But it’s piece de resistance has to be the astonishing Rain Vortex waterfall which dominates the centre of the garden, and stands 130 ft high. It cascades down from a round hole in the glass ceiling and an incredible 38,000 litres of recirculating rain water is pumped through the hole every minute. Below it is a huge basement level pool.

The glass roof, which is toroid shaped, is made up of over 9,000 pieces of glass. At night it becomes the  360 degree backdrop for a light and sound show, which sadly we could not stay for.

It’s a truly astonishing piece of engineering and design, and it is incredible to think that it is inside an airport.

We just didn’t have time to visit the canopy park, which is about $5 to enter, or the canopy mazes, but I was able to walk down to the bottom of the waterfall and stand and gaze in awe at its beauty.

It seems odd to want to spend more time in an airport, but there is still so much to see here in Jewel that I hope one day to return."
6,"I didn't believe that an airport could actually be a destination, but this one is.  If you are visiting Singapore, or have a layover, you MUST spend time in this airport.  Best if you can visit ""The Jewel"" at night, but beautiful any time. The entire airport is worth exploring."
7,"wide range of food selection, food is nice and lots of seat inside teh resturant, impressive design and you will not know is this an airport."
8,"It's no surprise that this has been voted the best airport in the world 7 times.  The indoor waterfall is spectacular - even better when the light shows are on.  There are lots of things to do, though you do have to pay for some of them.  There are plenty of eateries, but allow time if you are travelling at the weekend."
9,"Amazing place so much more than a shopping mall and the waterfall is amazing with or without the light show
A complete entertainment centre on the top level 
Plenty of venues for food and drink
Caters for all age groups"
10,This is really amazing never seen anything like this anywhere in the world. The view of the waterfall is breathtaking and very relaxing. You can go to different level and view the waterfall. You can get better view of waterfall on level 3. There are plenty seating areas to enjoy this waterfall. If you are in the airport this is a must visit.
11,"We chose to have a long layover in Singapore (15hrs) to be able to explore it for a day. This adventure started at the airport which we could have stayed in for the entire 15 hours without getting bored. They have many unique free things to do and see while you wait in the airport including a butterfly garden! This particular airport has been rated top in the world for the past 6 years and has definitely earned that title. The Jewel is the latest in their attractions and now holds the world record for the largest indoor waterfall. Hidden near the arrival hall of terminal 1 this is worth stopping by. This end of the airport includes a high end shopping mall with many international stores which hide the waterfall while adding more mystique to the attraction. There are many levels of stairs and walkways surrounding the jewel to allow you to get different perspectives of it and the iconic selfie by it. While we were there they had signs displayed that mentioned new additions to the Jewel experience this year which include a canopy bridge. This entire area of the airport will be adding over 10 new attractions estimated by the end of this year (2019). We highly advise stopping by even for a small layover to at least witness the airport for yourself. Keep in mind if you have a layover for over 5 hours the airport also offers free tour bus rides of Singapore as well!
- @wanderingwithustwo"
12,"Been there multiple times and I haven't yet step into every single shop! I've been to different restaurants every time I went there and their service and food are good! Airport has always been a good hang out place and ever since Jewel's arrival, it just made things much better and enjoyable! 
For families with kids, I suggest you guys to visit the Canopy Park at the top floor! They will have tons of fun there!"
13,"Had a 10- hour layover and after sleeping at the hotel at the airport, we checked out the Jewel, which opened in October 2019. It's lush, peaceful, and air-conditioned, but you feel like you are outside. Definitely worth spending some time to see it - I viewed a documentary about it on a Singapore Airlines flight - it is immaculate and they do a great job of keeping it in tip-top shape."
14,This is one amazing place located at the airport. The vortex and indoor forest and almost too real.. Nice glass Walkway to see the vortex.
15,Beautiful with different stores (not all the same old brands!) and a fun set of attractions. We got the senior set 1 of 5 activities for S$27. Very clean!  They check your temperature and spray hand sanitizer on your hands at each section. Loved the mirror maze most!
16,"This is the latest addition to Changi Airport. It's huge with lots of shops and restaurants, as well as activities such as the Canopy Walk, maze etc. The trees and greenery really make it lovely. There are also flight check in counters here, where you can do an early check in, and then relax and wander around the place."
17,Amazing how quickly you actually can forget that you're on an airport waiting for a flight. In Terminal 1 in Changi Airport you enter Jewel and you instantly don't believe your eyes. There's this thrilling 40 meter high waterfall surrounded by beautiful tropical plants and trees. You can take a walk at different levels and/or visit the adjacent Canopy Park (small admission fee) with some nice attractions. So when you have a flight out of Singapore vond early and enjoy this awesome place. Luggage can be stored near the Jewel entrance and there also is an early check in.
18,"Jewel is one of the best things added to Changi airport in the last 10 years and has greatly raised the convenience of the aged Terminal One. Good mix of restaurants and retailers (especially liked Tokyu Hands, Muji, Bengawan Solo and the supermarket). Well done and keep it up please!"
19,"Simply the most incredible airport in the world , fabulous for restaurants, shopping, clean, quiet and sophisticated."
20,"At first bought the bundle ticket in order to do all activities and we thought that it was quite price : but it definitely worths every penny ! 

All activities were very funny and adapted for kids and big kids. 
Each part is very different from the others so it’s not boring and you can spend many hours there. The mall is also full of amazing shops and they are plenty of good restaurants , it’s such a good destination for a rainy Singaporean day."
21,That place is extraordinary.Im so amze with the vortex cant keep my eyes of it.Its very clean and very cool
22,I’d like to highly commend Carissa Santos from the Jewel Guest Centre who very kindly helped us find our car. Carissa noticed that I was repeating my steps when trying to locate our car in the car park and went out of her way to find me and assist me in finding my car. She was kind enough to spend a good 20 minutes helping us and even ensured we were safely in our car before saying goodbye. She went above and beyond what I expected - thank you Carissa!
23,"As a Singaporean, I'm proud to live in a country with the best airport in the world. You can spend the whole day at Jewel and you will still not feel that it is enough. Take your time and relax by the waterfall. The view of the waterfall, is best in any level you are at."
24,"I was an engineer for the project. Despite the fact that I have worked at the very same place on daily basis for almost 3 years, it never failed to amaze me every time I visit. Not sure about other, but it always reminds me of the Jurassic Park, of course, without the dinosaurs."
25,"We were amazed at the design of the place. 
So much thought has gone into the design. The shops are a shopaholics dream. There are many restaurants available including a Pizza Express where we enjoyed a lovely meal.
The most amazing part for us was the waterfall and the planting and the gardens. 
The best  bit was at 9.30pm when they have a light show on the fountain, just amazing. It has to be seen to be fully appreciated.  So glad we came to see it and would definitely recommend it."
26,We had a chance to fly through the Singapore Changi airport.  The Jewel at Terminal 1 is something that cannot be missed.  The waterfall is a sight to behold.  Take the escalators to the top floor and there are bars and restaurants overlooking the waterfall and gardens.  At each level in between are more restaurants and shopping.  You will think you are in a high-end mall and not an airport terminal.  The Jewel has to be seen to be believed!
27,"Jewel Changi Airport will definitely be an ideal location to carry out wedding proposal. Although it is a nerve-wrecking experience to carry out wedding proposal in a crowded place, there is no worry of rain or shine as it is an indoor environment. With just simple preparation, coupled with the setting - she worn the diamond on 20th May 2019 at 1314hr."
28,The airport itself is a tourist attraction. It's super modern and at the same time close to nature feels. Waiting for a long flight scheduled? Jewel got your back!
29,"We really enjoy our quality hours at Jewel shopping mall Changi airport, not only for shopping and eating, but also for exploring an amazing Neo- futurism architectural style. This iconic building is designed by the world- renowned architect Moshe Safdie, (a 81 years old, Israeli-born who is behind iconic Marina Bay Sands resort). It is opened in April 2019 to welcome 300,000 visitors per day, so far we heard that over 50 millions have visited it. The highlight of Jewel atrium is the largest indoor water fall - 40 meters high rain vertex and 5 storey-forest-valley with walking trails. This iconic spot is highly recommended especially at night time you will be able to marvel the colorful light show."
30,The Rain Vortex is absolutely mesmerising. Make sure to catch the show if you are visiting in the evening! Each show lasts about 5 mins and runs from 8.30pm to 12.30am daily at hourly intervals. Hands down the best experience you can get at an airport!
31,"We went to see JEWEL at Terminal 1 on our way out of Singapore. Must see when in
Singapore. Multilevel greenery in Terminal 1 with a tremendous waterfall, 40 meters tall, in the center, dropping from the ceiling and disappearing into the floor, on level 1. Your view of this amazing waterfall changes with the level you are viewing from. There is greenery throughout this immaculately clean airport."
32,"A great place to spend time in transit. Early checkin for several airlines saved the day, and allowed us to look around more freely."
33,"We spent a day here (including having lunch in the middle),  the waterfall was a beautiful sight. We bought a package to enter the canopy park and do all the attractions. Loved the Mirror maze, the mist bridge and the bouncy nets. The net walk was harder and scarier than we expected, little feet go through the net. See the waterfall from all the different levels using the elevator. Kids loved this place (aged 6 and 9)"
34,This is really amazing and worth the visit. Make sure you watch the light show in the evening at the indoor waterfall. It’s really relaxing just sitting and watching the waterfall here during anytime of the day. I have visited a few times when returning to Singapore at Terminal 1. Changi airport has always been amazing but the Jewel took it to a new level. Would definitely recommend it.
35,"We took the opportunity to visit Jewel. This is a very well done project. It is very comfortable to walk around and have your meals here. There are many restaurants and eateries, a food court and supermarket as well."
36,A truly wondrous experience. If ever there was a place that has the potential to reignite a sense of childish wonder in a world full of competing sensory experiences this is it. Set in Changi Airport “Jewel” is a destination in itself and one where you could quite easily spend a
37,"We came there only for the waterfall and the green sourroundings, but we observed that there were quite a few restaurants, cinema etc. in addition to the waterfall.Very nice waterfall, and a great building."
38,"Large shopping mall. Convenient for the travellers and locals. No more worries to find place to kill times while waiting for the flights. There are lounges, early check in, luggage service, food, shops and all the activities! "
39,"I have been to many world city airports, and Changi Airport is simply amazing, and one of the best airports that I have been too!  Changi Airport was designed in mind with entertaining people, and two areas that will be on my list next time is Kinetic Rain, and the five unique"
40,The Jewel at Changi Airport is a delightful step away from the traditional airport building. The combination of an amazing attraction with many retail and restaurant options in an airport location is alluring to both tourists as well as locals.
41,"Nestled at the heart of Changi Airport is this work of art that even Picasso can’t even believe. Name better way to welcome a tourist coming from overseas to Singapore. I bet you can’t. Jewel is indeed Singapore’s Jewel alongside with the famous Gardens by the Bay. Such an eyecandy. And to all the tourist travelling SG, please, do yourself a favor, before going to your homestay or hotel, walk an extra meter to see this work of art."
42,Nice place for shopping and in built magnificent waterfall is awesome to view and overall a nice experience
43,"The best place to waste time whilst waiting to catch your flight. Magnificent architecture and gardens around waterfall. Shopping, food courts etc- entertainment- it’s a great way to kill a few hours."
44,"Wow what can I say.... This gem will knock sports of most attractions and certainly any global airport. 

If you are not flying from T1 and can get to the airport a little earlier then get yourself over to “The Jewel” around 10min walk from T3. I promise you this you will not be disappointed. 

A must see ❤️"
45,"Situated opposite T1 we checked our luggage in early here downstairs and left luggage here too. The centre has an amazing indoor waterfall/feature set amongst what I would describe as a tropical rain forest, similar to the design of the Cloud Forest dome. Inside are loads of"
46,Beautifully designed. An instagram magnet. Has all the best restaurants in Asia here. We has the best dim sums. Highly recommended. Can be busy around the atrium fountain btw.
47,It's number 1 ranked in the world for a reason. Every terminal shop and gate feels like luxury. Amazing waterfall! Long walk from some terminals but worth it.
48,"Although we flew into Changi Airport, we were leaving from a different city - thus needed to take public transportation back into the airport so we could experience Jewel, the Operculum that takes your breath away.  It is so refreshing to experience; you really do need to"
49,"i end up at Jewel Changi Airport after i'm finish up my assignn't at other place in singapore....suprisingly, Jewel really easy to found from mrt station at terminal 3 coz of large and clear signboard...after a long walk( about 15 min ), finally indoor waterfall caught my eyes"
50,"First things first, we walked a lot, I mean a lot. So be prepared if you want to go to see the amazing waterfall. It was a good experience as we had some no of hours for our flight. We did not go anywhere else to be honest, just roamed around the waterfall, with all the greenery."
51,"Top mall that showcases our futuristic vortex waterfall with light shows every evening. Fab mix of retail brands ranging from casual to high-end and a wide variety of restaurant types and cuisines. Child-friendly, the top floor features an indoor park for children and adults to climb, stroll, and chill. B2 has a child-friendly cinema at Shaw theatres that has a play area for the kids while the adults watch the show. So huge that you can get a bit lost, but there are handy touchscreen info electronic boards at almost every escalator. Favourite new mall in the east!"
52,"My husband and I were in Singapore’s Changi Airport last December for our flight home.   Jewel is Singapore’s newest attraction - a large nature-themed retail complex located adjacent to the airport.  There are many restaurants inside – both high-end and Hawker style dining in the basement.   It’s free to enter (no luggage carts), but the attractions have fees.   If you have luggage and bags, there are several baggage storage shops available before you enter.

The star of this place is their indoor waterfall.  It’s the world’s tallest at 40 meters (131 ft).  Since it was very crowded around the waterfall, we walked around until we found a quiet place to sit and admire this beautiful rain vortex surrounded by lush plants and trees. 

But my favorite feature of Jewel is their restrooms!  Some toilets have Japanese style bidets that squirt water from underneath the seat.  It was pretty AWESOME!  I think ALL the public restrooms in the world should have this feature!  

Jewel is a perfect place to be if you have a lot of time to spare in the Singapore airport.  It is a destination in itself!"
53,"Anyone arriving into Singapore must not miss to visit The Jewel Side in the terminal.One of the most relaxing environment with water features lots of Greenery ,sound effects and also many restaurants to eat from.You can also visit it during your transit to else where . Singapore Changi consists of 4 terminals but all inter connected.Either you take a stroll or use the terminal trains.
Enjoy your time there."
54,"Destination itself. Well worth spending time. You can check bags in early here, print boarding passes and enjoy! Great shopping to browse and fantastic choice of eating!!! 
The waterfall is amazing and area great place to chill and relax."
55,"Jewel is the latest attraction in Changi Airport. It comprises of fashion shops, eateries and exclusive attractions such as mirror maze, canopy park, hedge maze etc. The main attraction of Jewel is the rain vortex! It is gorgeous!"
56,"Basically this is a entry free version of the flower dome from Gardens by the bay. 
If you are flying out, make sure you do not go through customs. The Jewel is a public access mall. Problem is with the your bags. As trolleys are not allowed in the elevator(what are they thinking when they design this place). As a trade off, there is a baggage storage at ground level. 
Best light show happens after dark."
57,"if you are in Singapore and missed jewel changi  then your trip is useless.
jewel has so much to offer you for whole day.
actually its a part of airport it self but you can't visit if you don't have visa for Singapore bcz you have to pass through immigration then you may go there by free airport bus.
i planned my visit on first day only after i landed in Singapore. bcz my flight arrival was at morning 10.30 so i planned my first day till evening 7.00 there only.  around 7pm there is free sound and light show at HSBC rain vortex   don't miss it.

basement to floor 5th  so much to see, shopping, etc. and on 5th floor there are few activities you must try. buy its combo tickets from its website only. don't buy separate attractions on website.

for me bouncing net and mirror maze  was very exciting.  you may jump as much you can on bouncing net. forget your age and just chill."
58,"We had a 2am flight so arrived with plenty of time to explore the Jewel.  Wasn’t aware everything closes early.  The light show on the waterfall was still on and amazing.  Wheelchair friendly mostly everywhere.  Sorry we missed it during open hours.  Found it difficult to find somewhere to eat. Was a weekend so perhaps could look at later closing hours.  Accessibility amenities available. And  lifts, just spread out."
59,"Don't visit Singapore , or transit via Changi Airport without visiting 'The Jewel' ! The name is well deserved : Impressive construction , beautiful indoor waterfall surrounded by an indoor tropical garden , great shopping and restaurants within the structure..."
60,If you have about 20 minutes to spare then head down to the magnificent Jewel terminal which has a stunning waterfall and a lot of indoor greenery. We walked to it from inside the departure terminal before checking in for our flight.
61,"We did not have time to spend in the airport before or after our flight and I could not leave Singapore without seeing the Jewel. So, we took a subway and spent all day at the airport. Words cannot describe how beautiful this place is. Bright and airy, clean, tons of space to sit and enjoy and, the rain vortex left me speechless. Do not miss the Canopy Park. I recommended going early in the morning before the airport rush. It will be well worth it. You don't need a boarding pass to enter Jewel. It's directly connected to MRT station and signs to guide you there are clearly posted."
62,"Well got here about five hours early for our flight ; but didn’t bother me as I was under the impression there was lots to do at the airport . There isn’t ; there are plenty of places to grab something to eat and some duty free and other shops , but I think they were all rather expensive . Went to butterfly garden and it was smaller than I thought it would be and I didn’t see one butterfly ; might of had something to do with the fact that it was nighttime ; but if that’s the case they should put a sign up to let people know ; do butterflies sleep at night ,I don’t know and obviously neither did all the other people that were in there expecting to see butterflies"
63,"We recently had an opportunity to visit Singapore for the Asian Airshow. While there we got to visit the Jewel and it is amazing, incredible and a must see. It alone makes Changi the most incredible airport. We also happened to eat at a restaurant in the Jewel. However, while the meal was great, we could not keep our eyes off the waterfall. In addition to rain pouring in, the waterfall also periodically becomes a mister bellowing out a cloud from the oculus in the ceiling. However the one is simply one part. The overall round glass structure is just as amazing and complete with its own areal playground. Not to mention see the monorail pass directly though it. Great feature and amazing attraction."
